{
  "$schema": "https://json-schema.org/draft/2020-12/schema",
  "$id": "https://assess.avd-ops.dev/schemas/avd-assess-method/v1.json",
  "title": "avd-assess-method/v1: the rules avd-assess's method runs (method.json)",
  "description": "Contract C20. The machine-readable part of avd-assess's gap files: where each fact comes from (collection), declarative checks of published claims against registered facts (assessment), what each C14 decision needs (readiness) and how outcomes roll up (scoring). No code: a check is a JSON pointer, a filter and an expectation. avd-current-state runs a byte-identical copy pinned by commit; the brain checks it with Test-AssessMethod.",
  "type": "object",
  "required": ["schema", "version", "factRegister", "collection", "checks", "readiness", "scoring"],
  "additionalProperties": false,
  "$defs": {
    "deprecated": {"type": "object", "description": "Marks an ID that a later major release may remove (docs/distribution-spec.md section 6): the release that first carried the mark and the ID that replaces it, if any. Readers keep using a deprecated ID until it is gone.", "required": ["since"], "additionalProperties": false, "properties": {"since": {"type": "string", "pattern": "^(0|[1-9][0-9]*)\\.(0|[1-9][0-9]*)\\.(0|[1-9][0-9]*)$"}, "replacedBy": {"type": ["string", "null"]}}},
    "remediation": {
      "type": "object",
      "description": "What would make a non-pass outcome pass, as a hint for the remediation plan (C24). lz-parameter: an avd-landing-zone parameter and the public value it should take; lz-setting: something the landing zone always applies, so a redeploy from it fixes the finding; manual: outside what a landing zone redeploy fixes, with a code, never free text (rebuild-hosts: hosts the landing zone deploys have it, existing hosts must be replaced).",
      "required": ["kind"],
      "additionalProperties": false,
      "properties": {
        "kind": { "enum": ["lz-parameter", "lz-setting", "manual"] },
        "name": { "type": "string", "pattern": "^[a-z][A-Za-z0-9-]{2,60}$" },
        "to": { "$ref": "#/$defs/publicValue" },
        "code": { "enum": ["collect-evidence", "rebuild-hosts", "private-value", "outside-landing-zone", "process", "no-known-change"] }
      },
      "allOf": [
        { "if": { "properties": { "kind": { "const": "manual" } } }, "then": { "required": ["code"], "properties": { "name": false, "to": false } }, "else": { "required": ["name"], "properties": { "code": false } } },
        { "if": { "properties": { "kind": { "const": "lz-setting" } } }, "then": { "properties": { "to": false } } }
      ]
    },
    "publicValue": {
      "description": "A public value only: a SKU, a count, a boolean, a region. Never a name, prefix or address: a string starts with a letter and holds only letters, digits and underscores, so an address, a CIDR prefix or a hyphenated resource name can't pass.",
      "oneOf": [
        { "type": "string", "pattern": "^[A-Za-z][A-Za-z0-9_]{0,63}$" },
        { "type": "integer" },
        { "type": "boolean" }
      ]
    },
    "factId": { "type": "string", "pattern": "^(c11|c12|intake|liquidware)\\.[A-Za-z0-9.]{2,80}$" },
    "claimRef": { "type": "string", "pattern": "^ref:[a-z0-9][a-z0-9-]{1,63}#[A-Za-z0-9][A-Za-z0-9.:-]{0,63}$" },
    "gapRef": { "type": "string", "pattern": "^gap:[a-z0-9][a-z0-9-]{1,63}$" },
    "decisionId": { "type": "string", "pattern": "^[a-z][A-Za-z.]{1,40}$" },
    "pointer": { "type": "string", "pattern": "^(/([A-Za-z][A-Za-z0-9]{0,40}|\\*))+$", "description": "JSON pointer into a C11 snapshot or a C19 intake; * is every array item" },
    "property": { "type": "string", "pattern": "^[A-Za-z][A-Za-z0-9]{0,40}(/[A-Za-z][A-Za-z0-9]{0,40}){0,3}$", "description": "Relative to each subject" },
    "scalar": { "type": ["string", "number", "boolean", "null"] },
    "test": {
      "type": "object",
      "minProperties": 1,
      "maxProperties": 1,
      "additionalProperties": false,
      "properties": {
        "eq": { "$ref": "#/$defs/scalar" },
        "ne": { "$ref": "#/$defs/scalar" },
        "min": { "type": "number" },
        "max": { "type": "number" },
        "in": { "type": "array", "minItems": 1, "items": { "$ref": "#/$defs/scalar" } }
      }
    },
    "line": { "type": "string", "minLength": 3, "maxLength": 160, "pattern": "^[^\\n\\r]+$" }
  },
  "properties": {
    "$schema": { "type": "string" },
    "schema": { "const": "avd-assess-method/v1" },
    "version": { "type": "integer", "minimum": 1, "description": "Bumped on any change to a check, a readiness rule or the scoring; C21 reports pin it" },
    "landingZoneCommit": { "type": "string", "pattern": "^[0-9a-f]{40}$", "description": "Optional: the avd-landing-zone commit whose bicep/main.bicep the checks' lz-parameter and lz-setting hints were read from" },
    "factRegister": { "type": "integer", "minimum": 1, "description": "The C15 register version the method's fact IDs come from" },
    "collection": {
      "type": "array",
      "description": "Where each fact comes from, a gap file in avd-assess. Each row cites the reference that documents the property; only the join is ours.",
      "items": {
        "type": "object",
        "required": ["fact", "from", "claims"],
        "additionalProperties": false,
        "properties": {
          "fact": { "$ref": "#/$defs/factId" },
          "from": { "enum": ["resource-graph", "arm-rest", "wara", "insights", "intake"] },
          "table": { "type": "string", "pattern": "^[A-Za-z][A-Za-z0-9_.-]{1,80}$", "description": "Resource Graph table (Resources, DesktopVirtualizationResources, PolicyResources) or Insights table" },
          "type": { "type": "string", "pattern": "^[a-z]+\\.[a-z]+(/[a-z]+){1,3}$", "description": "ARM resource type the row reads, for example microsoft.desktopvirtualization/hostpools" },
          "property": { "type": "string", "pattern": "^[A-Za-z][A-Za-z0-9_./\\[\\]-]{0,120}$" },
          "claims": { "type": "array", "items": { "anyOf": [{ "$ref": "#/$defs/claimRef" }, { "$ref": "#/$defs/gapRef" }] } }
        }
      }
    },
    "checks": {
      "type": "array",
      "minItems": 1,
      "items": {
        "type": "object",
        "required": ["id", "title", "pillar", "severity", "claims", "facts", "rule", "informs"],
        "additionalProperties": false,
        "properties": {
          "id": { "type": "string", "pattern": "^asm-[a-z0-9-]{3,60}$" },
          "deprecated": { "$ref": "#/$defs/deprecated" },
          "title": { "$ref": "#/$defs/line" },
          "pillar": { "enum": ["reliability", "security", "cost", "operations", "performance"] },
          "severity": { "enum": ["high", "medium", "low"] },
          "claims": { "type": "array", "minItems": 1, "items": { "$ref": "#/$defs/claimRef" } },
          "facts": { "type": "array", "minItems": 1, "uniqueItems": true, "items": { "$ref": "#/$defs/factId" } },
          "rule": {
            "type": "object",
            "required": ["each", "expect"],
            "additionalProperties": false,
            "description": "For each subject at 'each' that matches 'where', every 'expect' test must hold. A missing property makes that subject unknown, never a failure.",
            "properties": {
              "each": { "$ref": "#/$defs/pointer" },
              "where": { "type": "object", "propertyNames": { "$ref": "#/$defs/property" }, "additionalProperties": { "$ref": "#/$defs/test" } },
              "expect": { "type": "object", "minProperties": 1, "propertyNames": { "$ref": "#/$defs/property" }, "additionalProperties": { "$ref": "#/$defs/test" } },
              "onFail": { "enum": ["gap", "warn"], "default": "gap", "description": "warn: a trade-off to review, not a defect" }
            }
          },
          "informs": { "type": "array", "uniqueItems": true, "items": { "$ref": "#/$defs/decisionId" } },
          "remediation": { "$ref": "#/$defs/remediation" }
        }
      }
    },
    "readiness": {
      "type": "array",
      "description": "One row per C14 decision (gap:decision-readiness).",
      "items": {
        "type": "object",
        "required": ["decision", "readiness", "facts", "claims"],
        "additionalProperties": false,
        "properties": {
          "decision": { "$ref": "#/$defs/decisionId" },
          "readiness": { "enum": ["decidable", "decidable-with-intake", "needs-measurement"] },
          "facts": { "type": "array", "uniqueItems": true, "items": { "$ref": "#/$defs/factId" }, "description": "Facts that decide it; for needs-measurement, the forensic facts a measurement would supply" },
          "claims": { "type": "array", "items": { "anyOf": [{ "$ref": "#/$defs/claimRef" }, { "$ref": "#/$defs/gapRef" }] } }
        }
      }
    },
    "scoring": {
      "type": "object",
      "description": "gap:scoring, a research hypothesis: a pillar's score is the passing severity weight over the assessed weight, warn counting warnFactor; coverage (checks not unknown over all checks) is always shown beside it; no overall number.",
      "required": ["model", "weights", "warnFactor", "overall"],
      "additionalProperties": false,
      "properties": {
        "model": { "const": "severity-weighted/v1" },
        "weights": {
          "type": "object",
          "required": ["high", "medium", "low"],
          "additionalProperties": false,
          "properties": { "high": { "type": "number", "exclusiveMinimum": 0 }, "medium": { "type": "number", "exclusiveMinimum": 0 }, "low": { "type": "number", "exclusiveMinimum": 0 } }
        },
        "warnFactor": { "type": "number", "minimum": 0, "maximum": 1 },
        "overall": { "const": false, "description": "Version 1 has no single overall number (the owner's call to change)" }
      }
    }
  }
}
