{
  "schema": "avd-assess-method/v1",
  "version": 3,
  "factRegister": 1,
  "landingZoneCommit": "ae6e80b574cccde570d0053d4c62b519d31052a8",
  "collection": [
    {
      "fact": "c11.subscription.regions",
      "from": "resource-graph",
      "table": "Resources",
      "property": "location",
      "claims": [
        "ref:resource-graph-tables#avd-objects-in-resources",
        "gap:collection-map"
      ]
    },
    {
      "fact": "c11.subscription.defenderPlans",
      "from": "resource-graph",
      "table": "SecurityResources",
      "type": "microsoft.security/pricings",
      "property": "properties.pricingTier",
      "claims": [
        "ref:review-checklists-avd#G03.04",
        "gap:collection-map"
      ]
    },
    {
      "fact": "c11.hostPool.count",
      "from": "resource-graph",
      "table": "Resources",
      "type": "microsoft.desktopvirtualization/hostpools",
      "property": "id",
      "claims": [
        "ref:resource-graph-tables#avd-objects-in-resources"
      ]
    },
    {
      "fact": "c11.hostPool.region",
      "from": "resource-graph",
      "table": "Resources",
      "type": "microsoft.desktopvirtualization/hostpools",
      "property": "location",
      "claims": [
        "ref:resource-graph-tables#avd-objects-in-resources"
      ]
    },
    {
      "fact": "c11.hostPool.type",
      "from": "resource-graph",
      "table": "Resources",
      "type": "microsoft.desktopvirtualization/hostpools",
      "property": "properties.hostPoolType",
      "claims": [
        "ref:resource-graph-tables#avd-objects-in-resources",
        "ref:avd-rest-api#hostpool-properties"
      ]
    },
    {
      "fact": "c11.hostPool.preferredAppGroupType",
      "from": "resource-graph",
      "table": "Resources",
      "type": "microsoft.desktopvirtualization/hostpools",
      "property": "properties.preferredAppGroupType",
      "claims": [
        "ref:resource-graph-tables#avd-objects-in-resources",
        "ref:avd-rest-api#hostpool-properties"
      ]
    },
    {
      "fact": "c11.hostPool.appGroups",
      "from": "resource-graph",
      "table": "Resources",
      "type": "microsoft.desktopvirtualization/applicationgroups",
      "property": "properties.applicationGroupType",
      "claims": [
        "ref:resource-graph-tables#avd-objects-in-resources",
        "ref:avd-rest-api#applicationgroup-properties"
      ]
    },
    {
      "fact": "c11.hostPool.maxSessionLimit",
      "from": "resource-graph",
      "table": "Resources",
      "type": "microsoft.desktopvirtualization/hostpools",
      "property": "properties.maxSessionLimit",
      "claims": [
        "ref:resource-graph-tables#avd-objects-in-resources",
        "ref:avd-rest-api#hostpool-properties"
      ]
    },
    {
      "fact": "c11.hostPool.startVmOnConnect",
      "from": "resource-graph",
      "table": "Resources",
      "type": "microsoft.desktopvirtualization/hostpools",
      "property": "properties.startVMOnConnect",
      "claims": [
        "ref:resource-graph-tables#avd-objects-in-resources",
        "ref:avd-rest-api#hostpool-properties"
      ]
    },
    {
      "fact": "c11.hostPool.redirection.drives",
      "from": "resource-graph",
      "table": "Resources",
      "type": "microsoft.desktopvirtualization/hostpools",
      "property": "properties.customRdpProperty",
      "claims": [
        "ref:avd-rest-api#hostpool-properties",
        "ref:rdp-properties#redirection-properties",
        "gap:collection-map"
      ]
    },
    {
      "fact": "c11.hostPool.redirection.clipboard",
      "from": "resource-graph",
      "table": "Resources",
      "type": "microsoft.desktopvirtualization/hostpools",
      "property": "properties.customRdpProperty",
      "claims": [
        "ref:avd-rest-api#hostpool-properties",
        "ref:rdp-properties#redirection-properties",
        "gap:collection-map"
      ]
    },
    {
      "fact": "c11.hostPool.redirection.printers",
      "from": "resource-graph",
      "table": "Resources",
      "type": "microsoft.desktopvirtualization/hostpools",
      "property": "properties.customRdpProperty",
      "claims": [
        "ref:avd-rest-api#hostpool-properties",
        "ref:rdp-properties#redirection-properties",
        "gap:collection-map"
      ]
    },
    {
      "fact": "c11.hostPool.redirection.usb",
      "from": "resource-graph",
      "table": "Resources",
      "type": "microsoft.desktopvirtualization/hostpools",
      "property": "properties.customRdpProperty",
      "claims": [
        "ref:avd-rest-api#hostpool-properties",
        "ref:rdp-properties#redirection-properties",
        "gap:collection-map"
      ]
    },
    {
      "fact": "c11.hostPool.redirection.comPorts",
      "from": "resource-graph",
      "table": "Resources",
      "type": "microsoft.desktopvirtualization/hostpools",
      "property": "properties.customRdpProperty",
      "claims": [
        "ref:avd-rest-api#hostpool-properties",
        "ref:rdp-properties#redirection-properties",
        "gap:collection-map"
      ]
    },
    {
      "fact": "c11.hostPool.redirection.smartCards",
      "from": "resource-graph",
      "table": "Resources",
      "type": "microsoft.desktopvirtualization/hostpools",
      "property": "properties.customRdpProperty",
      "claims": [
        "ref:avd-rest-api#hostpool-properties",
        "ref:rdp-properties#redirection-properties",
        "gap:collection-map"
      ]
    },
    {
      "fact": "c11.hostPool.redirection.camera",
      "from": "resource-graph",
      "table": "Resources",
      "type": "microsoft.desktopvirtualization/hostpools",
      "property": "properties.customRdpProperty",
      "claims": [
        "ref:avd-rest-api#hostpool-properties",
        "ref:rdp-properties#redirection-properties",
        "gap:collection-map"
      ]
    },
    {
      "fact": "c11.hostPool.redirection.webAuthn",
      "from": "resource-graph",
      "table": "Resources",
      "type": "microsoft.desktopvirtualization/hostpools",
      "property": "properties.customRdpProperty",
      "claims": [
        "ref:avd-rest-api#hostpool-properties",
        "ref:rdp-properties#redirection-properties",
        "gap:collection-map"
      ]
    },
    {
      "fact": "c11.hostPool.sessionHosts.total",
      "from": "resource-graph",
      "table": "DesktopVirtualizationResources",
      "type": "microsoft.desktopvirtualization/hostpools/sessionhosts",
      "property": "id",
      "claims": [
        "ref:resource-graph-tables#dv-table-session-hosts"
      ]
    },
    {
      "fact": "c11.hostPool.sessionHosts.sessions",
      "from": "resource-graph",
      "table": "DesktopVirtualizationResources",
      "type": "microsoft.desktopvirtualization/hostpools/sessionhosts",
      "property": "properties.sessions",
      "claims": [
        "ref:resource-graph-tables#dv-table-session-hosts",
        "ref:avd-rest-api#sessionhost-properties"
      ]
    },
    {
      "fact": "c11.hostPool.sessionHosts.trustedLaunch",
      "from": "resource-graph",
      "table": "Resources",
      "type": "microsoft.compute/virtualmachines",
      "property": "properties.securityProfile",
      "claims": [
        "ref:avd-rest-api#sessionhost-properties",
        "ref:review-checklists-avd#G02.03",
        "gap:collection-map"
      ]
    },
    {
      "fact": "c11.hostPool.sessionHosts.notTrustedLaunch",
      "from": "resource-graph",
      "table": "Resources",
      "type": "microsoft.compute/virtualmachines",
      "property": "properties.securityProfile",
      "claims": [
        "ref:avd-rest-api#sessionhost-properties",
        "ref:review-checklists-avd#G02.03",
        "gap:collection-map"
      ]
    },
    {
      "fact": "c11.hostPool.vmSizes",
      "from": "resource-graph",
      "table": "Resources",
      "type": "microsoft.compute/virtualmachines",
      "property": "properties.hardwareProfile.vmSize",
      "claims": [
        "ref:resource-graph-tables#avd-objects-in-resources",
        "ref:avd-rest-api#sessionhost-properties",
        "gap:collection-map"
      ]
    },
    {
      "fact": "c11.hostPool.images",
      "from": "resource-graph",
      "table": "Resources",
      "type": "microsoft.compute/virtualmachines",
      "property": "properties.storageProfile.imageReference",
      "claims": [
        "ref:resource-graph-tables#avd-objects-in-resources",
        "gap:collection-map"
      ]
    },
    {
      "fact": "c11.network.virtualNetworks",
      "from": "resource-graph",
      "table": "Resources",
      "type": "microsoft.network/virtualnetworks",
      "property": "id",
      "claims": [
        "ref:resource-graph-tables#avd-objects-in-resources"
      ]
    },
    {
      "fact": "c11.network.customDnsVirtualNetworks",
      "from": "resource-graph",
      "table": "Resources",
      "type": "microsoft.network/virtualnetworks",
      "property": "properties.dhcpOptions.dnsServers",
      "claims": [
        "ref:resource-graph-tables#avd-objects-in-resources",
        "gap:collection-map"
      ]
    },
    {
      "fact": "c11.network.defaultRoutes",
      "from": "resource-graph",
      "table": "Resources",
      "type": "microsoft.network/routetables",
      "property": "properties.routes",
      "claims": [
        "ref:resource-graph-tables#avd-objects-in-resources",
        "gap:collection-map"
      ]
    },
    {
      "fact": "c11.network.privateEndpoints",
      "from": "resource-graph",
      "table": "Resources",
      "type": "microsoft.network/privateendpoints",
      "property": "id",
      "claims": [
        "ref:resource-graph-tables#avd-objects-in-resources"
      ]
    },
    {
      "fact": "c11.storage.count",
      "from": "resource-graph",
      "table": "Resources",
      "type": "microsoft.storage/storageaccounts",
      "property": "id",
      "claims": [
        "ref:resource-graph-tables#avd-objects-in-resources"
      ]
    },
    {
      "fact": "c11.storage.kind",